{
  "schema_version": 1,
  "kind": "toolgraph.preflight",
  "run_id": "0f5b2c1a-9a1e-4b7c-8f3d-2e6a7c9d0b41",
  "created_at": "2026-07-12T00:00:00+00:00",
  "graph_generation": 42,
  "agent": "codex",
  "agent_found": true,
  "profile": "review",
  "mode": "advisory",
  "eligible": [],
  "rejected": [{"candidate": "legacy::missing", "tool_key": null, "reason": "TOOL_NOT_FOUND"}],
  "features": [],
  "decision": "advisory_warn"
}
